{
  "hypotheses": [
    {
      "source_research_lead_ids": [
        "rl:760522e7bcdd6aac52de"
      ],
      "source_finding_ids": [
        "fd:d32982b130d9825f8327"
      ],
      "title": "Higher anion coordination predicts a stronger LiF-rich interphase signature under matched conditions",
      "statement": "Within matched high-voltage fast-charging lithium-metal electrolyte variants, increasing anion coordination relative to a lower-anion-coordination control will increase the LiF-rich interphase signature.",
      "independent_variable": {
        "name": "anion coordination strength",
        "manipulation_or_contrast": "Higher versus lower anion coordination in otherwise matched electrolyte variants."
      },
      "dependent_variable": {
        "name": "LiF-rich interphase signature",
        "measurement_or_observation": "A predefined LiF-sensitive interphase metric measured consistently across the compared variants."
      },
      "expected_relation": {
        "direction": "increase",
        "detail": "The higher-anion-coordination condition is expected to show a stronger predefined LiF-rich interphase signature than the lower-coordination condition."
      },
      "boundary_conditions": [
        "consistent interphase characterization criteria",
        "fast charging",
        "high voltage",
        "lithium metal anode",
        "matched electrolyte variants"
      ],
      "provenance_evidence_ids": [
        "ev:3e88da7bb098191e16cf",
        "ev:851a9927a5a502895bae",
        "ev:880f2f98084d75d04768"
      ],
      "provenance_mechanism_edge_ids": [
        "me:06cdaf84e920d43c3996",
        "me:8289dcf192477eece18b",
        "me:9a2ef66af0a8aa3b941d"
      ],
      "scientific_significance": "If supported, the hypothesis would show whether anion coordination is a transferable interphase-design variable rather than only a descriptor of one reported formulation.",
      "mechanism_reasoning": "The supplied evidence links anion-rich solvation to LiF-rich interphase formation and high Coulombic efficiency in the reported system. This motivates testing anion coordination as a variable, but does not establish the proposed cross-formulation relation.",
      "falsifiable_prediction": "When the intended anion-coordination contrast is present within the stated boundary, the higher-anion-coordination condition will show a reproducibly higher predefined LiF-rich interphase metric than the lower-coordination condition.",
      "falsification_condition": "The hypothesis is falsified within the stated boundary if the intended anion-coordination contrast is present but the higher-anion-coordination condition does not show a reproducibly higher predefined LiF-rich interphase metric.",
      "known_evidence_boundary": "Existing evidence supports the anion-rich-solvation to LiF-rich-interphase relationship in the reported LiFSI/FDEE system, but does not establish that increasing anion coordination across matched alternative formulations causes a stronger LiF-rich interphase signature.",
      "evidence_context_status": "boundary_limited",
      "uncertainties": [
        "Anion coordination may covary with solvent chemistry or concentration.",
        "The interphase signal may not uniquely represent the mechanism responsible for Coulombic-efficiency retention."
      ],
      "confidence": 0.66,
      "semantic_hypothesis_judgment": "valid_unvalidated_falsifiable_hypothesis",
      "hypothesis_id": "hy:a0cefcd1ee3aa7eb83d5",
      "claim_type": "unvalidated_falsifiable_hypothesis",
      "novelty_boundary": "derived_from_research_lead_not_established_by_sources",
      "provenance_basis": "support_derived",
      "local_hypothesis_key": "hypothesis-1"
    }
  ],
  "summary": {
    "input_research_lead_count": 1,
    "hypothesis_count": 1,
    "provenance_basis_counts": {
      "support_derived": 1,
      "conflict_derived": 0,
      "gap_derived": 0,
      "mixed": 0,
      "finding_only": 0
    },
    "evidence_context_counts": {
      "supported": 0,
      "uncertain": 0,
      "conflicting": 0,
      "boundary_limited": 1,
      "gap_limited": 0
    },
    "dropped_duplicate_hypothesis_count": 0,
    "dropped_over_limit_hypothesis_count": 0,
    "max_hypotheses": 4,
    "degraded": false
  },
  "audit": {
    "skill_id": "ot_falsifiable_hypothesis_generation",
    "task_id": "task-lmb-demo",
    "traceability_mode": "research_lead_containment_and_grounded_provenance",
    "guard_version": "s1-hypothesis-v2",
    "input_fingerprint": "e9f62a5301ab2a5eed8598fe7497021cc66124de7b1e51f1005a752535cae580",
    "claim_layer": "unvalidated_falsifiable_hypothesis",
    "novelty_boundary": "derived_from_research_lead_not_established_by_sources"
  },
  "generation_warnings": []
}
